<?xml version="1.0"?>
<xs:schema xmlns:xs="http://www.w3.org/2001/XMLSchema"
	targetNamespace="http://www.qcadoo.com/model" xmlns="http://www.qcadoo.com/model" elementFormDefault="qualified">

	<xs:element name="model">
		<xs:complexType>
			<xs:sequence>
				<xs:choice minOccurs="1" maxOccurs="unbounded">
					<xs:element name="integer" type="fieldType" />
					<xs:element name="string" type="stringFieldType" />
					<xs:element name="text" type="fieldType" />
					<xs:element name="decimal" type="fieldType" />
					<xs:element name="datetime" type="fieldType" />
					<xs:element name="date" type="fieldType" />
					<xs:element name="boolean" type="fieldType" />
					<xs:element name="belongsTo" type="belongsToFieldType" />
					<xs:element name="hasMany" type="hasManyFieldType" />
					<xs:element name="tree" type="treeFieldType" />
					<xs:element name="enum" type="enumFieldType" />
					<xs:element name="dictionary" type="dictionaryFieldType" />
					<xs:element name="password" type="fieldType" />
				</xs:choice>
				<xs:element name="priority" type="priorityFieldType"
					minOccurs="0" maxOccurs="1" />
				<xs:element name="validatesWith" type="hookType"
					minOccurs="0" maxOccurs="unbounded" />
				<xs:choice minOccurs="0" maxOccurs="unbounded">
					<xs:element name="onSave" type="hookType" />
					<xs:element name="onUpdate" type="hookType" />
					<xs:element name="onCreate" type="hookType" />
					<xs:element name="onCopy" type="hookType" />
					<xs:element name="onView" type="hookType" />
				</xs:choice>
				<xs:element name="identifier" type="identifierExpressionType"
					minOccurs="0" maxOccurs="1" />
			</xs:sequence>
			<xs:attribute name="name" type="identifierType" use="required" />
			<xs:attribute name="plugin" type="identifierType" use="optional" />
			<xs:attribute name="deletable" type="xs:boolean" />
			<xs:attribute name="insertable" type="xs:boolean" />
			<xs:attribute name="updatable" type="xs:boolean" />
		</xs:complexType>
	</xs:element>

	<xs:complexType name="identifierExpressionType">
		<xs:attribute name="expression" type="xs:string" />
	</xs:complexType>
	
	<xs:complexType name="validatesType">
		<xs:attribute name="message" type="xs:string" />
	</xs:complexType>

	<xs:complexType name="validatesLengthType">
		<xs:complexContent>
			<xs:extension base="validatesType">
				<xs:attribute name="min" type="xs:integer" />
				<xs:attribute name="is" type="xs:integer" />
				<xs:attribute name="max" type="xs:integer" />
			</xs:extension>
		</xs:complexContent>
	</xs:complexType>
	
	<xs:complexType name="validatesRangeType">
		<xs:complexContent>
			<xs:extension base="validatesType">
				<xs:attribute name="from" type="xs:string" />
				<xs:attribute name="to" type="xs:string" />
				<xs:attribute name="exclusively" type="xs:boolean" default="false" />
			</xs:extension>
		</xs:complexContent>
	</xs:complexType>
	
	<xs:complexType name="validatesRegexType">
		<xs:complexContent>
			<xs:extension base="validatesType">
				<xs:attribute name="pattern" type="xs:string" />
			</xs:extension>
		</xs:complexContent>
	</xs:complexType>
	
	<xs:complexType name="hookType">
		<xs:attribute name="class" type="classType" use="required" />
		<xs:attribute name="method" type="identifierType" use="required" />
	</xs:complexType>

	<xs:complexType name="fieldType">
		<xs:choice minOccurs="0" maxOccurs="unbounded">
			<xs:element name="validatesWith" type="hookType" />
			<xs:element name="validatesLength" type="validatesLengthType" />
			<xs:element name="validatesPrecision" type="validatesLengthType" />
			<xs:element name="validatesScale" type="validatesLengthType" />
			<xs:element name="validatesRange" type="validatesRangeType" />
			<xs:element name="validatesRegex" type="validatesRegexType" />
		</xs:choice>
		<xs:attribute name="name" type="identifierType" use="required" />
		<xs:attribute name="default" type="xs:string" />
		<xs:attribute name="readonly" type="xs:boolean" default="false" />
		<xs:attribute name="persistent" type="xs:boolean" default="true" />
		<xs:attribute name="required" type="xs:boolean" default="false" />
		<xs:attribute name="unique" type="xs:boolean" default="false" />
	</xs:complexType>

	<xs:complexType name="stringFieldType">
		<xs:complexContent>
			<xs:extension base="fieldType">
				<xs:attribute name="expression" type="xs:string" use="optional" />
			</xs:extension>
		</xs:complexContent>
	</xs:complexType>
	
	<xs:complexType name="belongsToFieldType">
		<xs:complexContent>
			<xs:extension base="fieldType">
				<xs:attribute name="model" type="identifierType" use="required" />
				<xs:attribute name="plugin" type="identifierType" />
				<xs:attribute name="lazy" type="xs:boolean" default="true" />
			</xs:extension>
		</xs:complexContent>
	</xs:complexType>

	<xs:complexType name="hasManyFieldType">
		<xs:complexContent>
			<xs:extension base="fieldType">
				<xs:attribute name="model" type="identifierType" use="required" />
				<xs:attribute name="plugin" type="identifierType" />
				<xs:attribute name="joinField" type="identifierType"
					use="required" />
				<xs:attribute name="cascade" type="cascadeType" default="none" />
				<xs:attribute name="copyable" type="xs:boolean" default="false" />
			</xs:extension>
		</xs:complexContent>
	</xs:complexType>
	
	<xs:complexType name="treeFieldType">
		<xs:complexContent>
			<xs:extension base="fieldType">
				<xs:attribute name="model" type="identifierType" use="required" />
				<xs:attribute name="plugin" type="identifierType" />
				<xs:attribute name="joinField" type="identifierType"
					use="required" />
				<xs:attribute name="cascade" type="cascadeType" default="none" />
				<xs:attribute name="copyable" type="xs:boolean" default="false" />
			</xs:extension>
		</xs:complexContent>
	</xs:complexType>

	<xs:complexType name="dictionaryFieldType">
		<xs:complexContent>
			<xs:extension base="fieldType">
				<xs:attribute name="plugin" type="identifierType" use="optional" />
				<xs:attribute name="dictionary" type="identifierType"
					use="required" />
			</xs:extension>
		</xs:complexContent>
	</xs:complexType>

	<xs:complexType name="enumFieldType">
		<xs:complexContent>
			<xs:extension base="fieldType">
				<xs:attribute name="values" use="required">
					<xs:simpleType>
						<xs:restriction base="xs:string">
							<xs:pattern value="[a-zA-Z0-9]*(,[a-zA-Z0-9]*)*" />
						</xs:restriction>
					</xs:simpleType>
				</xs:attribute>
			</xs:extension>
		</xs:complexContent>
	</xs:complexType>

	<xs:complexType name="priorityFieldType">
		<xs:attribute name="name" type="identifierType" use="required" />
		<xs:attribute name="scope" type="identifierType" use="optional" />
	</xs:complexType>

	<xs:simpleType name="cascadeType">
		<xs:restriction base="xs:string">
			<xs:enumeration value="delete" />
			<xs:enumeration value="none" />
		</xs:restriction>
	</xs:simpleType>
	
	<xs:simpleType name="deletableType">
		<xs:restriction base="xs:string">
			<xs:enumeration value="false" />
			<xs:enumeration value="true" />
			<xs:enumeration value="soft" />
		</xs:restriction>
	</xs:simpleType>

	<xs:simpleType name="identifierType">
		<xs:restriction base="xs:string">
			<xs:pattern value="[a-z][a-zA-Z0-9]*" />
		</xs:restriction>
	</xs:simpleType>
	
	<xs:simpleType name="classType">
		<xs:restriction base="xs:string">
			<xs:pattern value="[a-z][a-zA-Z0-9.]*.[a-zA-Z0-9]+" />
		</xs:restriction>
	</xs:simpleType>

</xs:schema>