<?xml version="1.0" encoding="UTF-8"?>
<!--

    ***************************************************************************
    Copyright (c) 2010 Qcadoo Limited
    Project: Qcadoo MES
    Version: 1.4

    This file is part of Qcadoo.

    Qcadoo is free software; you can redistribute it and/or modify
    it under the terms of the GNU Affero General Public License as published
    by the Free Software Foundation; either version 3 of the License,
    or (at your option) any later version.

    This program is distributed in the hope that it will be useful,
    but WITHOUT ANY WARRANTY; without even the implied warranty
    of MERCHANTABILITY or FITNESS FOR A PARTICULAR PURPOSE.
    See the GNU Affero General Public License for more details.

    You should have received a copy of the GNU Affero General Public License
    along with this program; if not, write to the Free Software
    Foundation, Inc., 51 Franklin St, Fifth Floor, Boston, MA  02110-1301  USA
    ***************************************************************************

-->
<model name="resourceCorrection"
       xmlns:xsi="http://www.w3.org/2001/XMLSchema-instance" xmlns="http://schema.qcadoo.org/model"
       xsi:schemaLocation="http://schema.qcadoo.org/model http://schema.qcadoo.org/model.xsd" auditable="true">
    <fields>
        <string name="number"/>
        <belongsTo name="product" model="product" plugin="basic"/>
        <decimal name="newQuantity">
            <validatesUnscaledValue max="9"/>
            <validatesScale max="5"/>
        </decimal>
        <decimal name="oldQuantity">
            <validatesUnscaledValue max="9"/>
            <validatesScale max="5"/>
        </decimal>
        <belongsTo name="location" model="location" plugin="materialFlow"/>
        <datetime name="time"/>

        <string name="_oldBatch"/>
        <string name="_newBatch"/>

        <belongsTo name="oldBatch" model="batch" plugin="advancedGenealogy"/>
        <belongsTo name="newBatch" model="batch" plugin="advancedGenealogy"/>

        <belongsTo name="resource" model="resource"/>

        <belongsTo name="oldStorageLocation" model="storageLocation"/>
        <belongsTo name="newStorageLocation" model="storageLocation"/>

        <decimal name="oldPrice"/>
        <decimal name="newPrice"/>

        <decimal name="oldConversion"/>
        <decimal name="newConversion"/>

        <belongsTo name="oldPalletNumber" model="palletNumber" plugin="basic"/>
        <belongsTo name="newPalletNumber" model="palletNumber" plugin="basic"/>

        <belongsTo name="oldTypeOfLoadUnit" plugin="basic" model="typeOfLoadUnit" />
        <belongsTo name="newTypeOfLoadUnit" plugin="basic" model="typeOfLoadUnit" />

        <date name="oldExpirationDate"/>
        <date name="newExpirationDate"/>

        <date name="productionDate"/>
        <string name="resourceNumber"/>
        <string name="deliveryNumber"/>

        <dictionary name="oldQualityRating" dictionary="qualityRating"/>
        <dictionary name="newQualityRating" dictionary="qualityRating"/>

        <hasMany name="resourceAttributeValueAfterCorrections" joinField="resourceCorrection"
                       model="resourceAttributeValueAfterCorrection" cascade="nullify"/>

        <hasMany name="resourceAttributeValueBeforeCorrections" joinField="resourceCorrection"
                       model="resourceAttributeValueBeforeCorrection" cascade="nullify"/>

    </fields>
    <hooks/>
</model>
