<?xml version="1.0" encoding="UTF-8"?>
<!--

    ***************************************************************************
    Copyright (c) 2010 Qcadoo Limited
    Project: Qcadoo MES
    Version: 1.4

    This file is part of Qcadoo.

    Qcadoo is free software; you can redistribute it and/or modify
    it under the terms of the GNU Affero General Public License as published
    by the Free Software Foundation; either version 3 of the License,
    or (at your option) any later version.

    This program is distributed in the hope that it will be useful,
    but WITHOUT ANY WARRANTY; without even the implied warranty
    of MERCHANTABILITY or FITNESS FOR A PARTICULAR PURPOSE.
    See the GNU Affero General Public License for more details.

    You should have received a copy of the GNU Affero General Public License
    along with this program; if not, write to the Free Software
    Foundation, Inc., 51 Franklin St, Fifth Floor, Boston, MA  02110-1301  USA
    ***************************************************************************

-->
<model name="modifyTechnologyHelper" auditable="true"
       xmlns:xsi="http://www.w3.org/2001/XMLSchema-instance" xmlns="http://schema.qcadoo.org/model"
       xsi:schemaLocation="http://schema.qcadoo.org/model http://schema.qcadoo.org/model.xsd">
    <fields>
        <boolean name="remove" default="false"/>
        <boolean name="addNew" default="false"/>
        <boolean name="replace" default="false"/>
        <string name="selectedEntities" required="true"/>
        <belongsTo name="product" plugin="basic" model="product"
                   required="true"/>
        <belongsTo name="replaceProduct" plugin="basic" model="product"/>
        <decimal name="replaceProductQuantity">
            <validatesRange from="0" exclusively="true"/>
            <validatesUnscaledValue max="9"/>
            <validatesScale max="5"/>
        </decimal>

        <hasMany name="modifyTechnologyAddProducts" model="modifyTechnologyAddProductHelper"
                 joinField="modifyTechnologyHelper" cascade="delete"/>

    </fields>
    <hooks>
        <validatesWith
                class="com.qcadoo.mes.technologies.validators.ModifyTechnologyHelperValidators"
                method="validatesWith"/>
    </hooks>
</model>
