<model name="salesPlanStateChange"
       xmlns:xsi="http://www.w3.org/2001/XMLSchema-instance" xmlns="http://schema.qcadoo.org/model"
       xsi:schemaLocation="http://schema.qcadoo.org/model http://schema.qcadoo.org/model.xsd">

    <fields>
        <!-- generic state change fields -->
        <datetime name="dateAndTime"/>
        <enum name="sourceState"
              values="01draft,02rejected,03completed"/>
        <enum name="targetState"
              values="01draft,02rejected,03completed"
              required="true"/>
        <enum name="status"
              values="01inProgress,02paused,03successful,04failure,05canceled"
              required="true"/>
        <integer name="phase"/>
        <string name="worker"/>
        <belongsTo name="salesPlan" model="salesPlan"/>
        <belongsTo name="shift" model="shift" plugin="basic"/>
    </fields>

    <hooks/>

</model>
