<?xml version="1.0" encoding="UTF-8"?>
<!--

    ***************************************************************************
    Copyright (c) 2010 Qcadoo Limited
    Project: Qcadoo MES
    Version: 1.4

    This file is part of Qcadoo.

    Qcadoo is free software; you can redistribute it and/or modify
    it under the terms of the GNU Affero General Public License as published
    by the Free Software Foundation; either version 3 of the License,
    or (at your option) any later version.

    This program is distributed in the hope that it will be useful,
    but WITHOUT ANY WARRANTY; without even the implied warranty
    of MERCHANTABILITY or FITNESS FOR A PARTICULAR PURPOSE.
    See the GNU Affero General Public License for more details.

    You should have received a copy of the GNU Affero General Public License
    along with this program; if not, write to the Free Software
    Foundation, Inc., 51 Franklin St, Fifth Floor, Boston, MA  02110-1301  USA
    ***************************************************************************

-->
<model name="position"
       xmlns:xsi="http://www.w3.org/2001/XMLSchema-instance" xmlns="http://schema.qcadoo.org/model"
       xsi:schemaLocation="http://schema.qcadoo.org/model http://schema.qcadoo.org/model.xsd">
    <fields>
        <belongsTo name="document" model="document"/>
        <belongsTo name="product" model="product" plugin="basic"
                   required="true"/>
        <decimal name="quantity" required="true">
            <validatesRange from="0" exclusively="true"/>
            <validatesUnscaledValue max="9"/>
            <validatesScale max="5"/>
        </decimal>
        <decimal name="givenQuantity">
            <validatesRange from="0" exclusively="true"/>
            <validatesUnscaledValue max="9"/>
            <validatesScale max="5"/>
        </decimal>
        <decimal name="price" default="0">
            <validatesRange from="0"/>
        </decimal>
        <decimal name="sellingPrice" default="0">
            <validatesRange from="0"/>
        </decimal>
        <belongsTo name="batch" model="batch" plugin="advancedGenealogy"/>

        <string name="unit" persistent="false"/>
        <dictionary name="givenUnit" dictionary="units"/>

        <date name="productionDate"/>
        <date name="expirationDate"/>
        <priority name="number" scope="document"/>
        <belongsTo name="resource" model="resource"/>
        <string name="resourceNumber"/>
        <string name="transferResourceNumber"/>

        <belongsTo name="storageLocation" model="storageLocation"/>

        <decimal name="conversion" default="0"/>
        <belongsTo name="palletNumber" model="palletNumber" plugin="basic"/>
        <dictionary name="typeOfPallet" dictionary="typeOfPallet"/>

        <hasMany name="reservations" model="reservation" joinField="position" copyable="true" cascade="delete"/>

        <string name="resourceReceiptDocument"/>

        <boolean name="waste" default="false"/>
        <dictionary name="qualityRating" dictionary="qualityRating"/>
        <datetime name="pickingDate" copyable="false"/>
        <belongsTo name="pickingWorker" model="user" plugin="qcadooSecurity" copyable="false"/>
        <hasMany name="positionAttributeValues" joinField="position"
                       model="positionAttributeValue"/>
    </fields>
    <hooks>
        <onCreate class="com.qcadoo.mes.materialFlowResources.hooks.PositionModelHooks" method="onCreate"/>
        <onCopy class="com.qcadoo.mes.materialFlowResources.hooks.PositionModelHooks" method="onCopy"/>
        <onSave class="com.qcadoo.mes.materialFlowResources.hooks.PositionModelHooks" method="onSave"/>
        <onDelete class="com.qcadoo.mes.materialFlowResources.hooks.PositionModelHooks" method="onDelete"/>
        <validatesWith class="com.qcadoo.mes.materialFlowResources.validators.PositionValidators"
                       method="checkAttributesRequirement"/>
        <validatesWith class="com.qcadoo.mes.materialFlowResources.validators.PositionValidators"
                       method="validateDates"/>

    </hooks>
</model>
