<!--

    ***************************************************************************
    Copyright (c) 2010 Qcadoo Limited
    Project: Qcadoo Framework
    Version: 1.4

    This file is part of Qcadoo.

    Qcadoo is free software; you can redistribute it and/or modify
    it under the terms of the GNU Affero General Public License as published
    by the Free Software Foundation; either version 3 of the License,
    or (at your option) any later version.

    This program is distributed in the hope that it will be useful,
    but WITHOUT ANY WARRANTY; without even the implied warranty
    of MERCHANTABILITY or FITNESS FOR A PARTICULAR PURPOSE.
    See the GNU Affero General Public License for more details.

    You should have received a copy of the GNU Affero General Public License
    along with this program; if not, write to the Free Software
    Foundation, Inc., 51 Franklin St, Fifth Floor, Boston, MA  02110-1301  USA
    ***************************************************************************

-->
<model name="materialRequirementCoverage" auditable="true" cacheable="true"
       xmlns:xsi="http://www.w3.org/2001/XMLSchema-instance" xmlns="http://schema.qcadoo.org/model"
       xsi:schemaLocation="http://schema.qcadoo.org/model http://schema.qcadoo.org/model.xsd">

    <fields>
        <string name="number" required="true" unique="true">
            <validatesLength max="255"/>
        </string>

        <datetime name="coverageToDate" required="true"/>
        <datetime name="actualDate" required="true"/>
        <datetime name="generatedDate"/>
        <string name="generatedBy">
            <validatesLength max="255"/>
        </string>
        <boolean name="orderGenerationInProgress" default="false"/>
        <boolean name="generated"/>
        <boolean name="saved"/>
        <boolean name="automaticSaveCoverage" default="false"/>
        <string name="fileName">
            <validatesLength max="1024"/>
        </string>

        <enum name="coverageType"
              values="01all,02withoutProductsFromWarehouse,03onlyShorcomingsAndDelays" default="01all" required="true"/>

        <enum name="includeInCalculationDeliveries"
                    values="01confirmedDeliveries,02unconfirmedDeliveries,03nonDraftDeliveries"
                    required="true" default="01confirmedDeliveries"/>
        <hasMany name="coverageLocations" joinField="materialRequirementCoverage"
                 model="coverageLocation" cascade="delete" copyable="true"/>

        <hasMany name="coverageAnalysisForOrders" joinField="materialRequirementCoverage"
                 model="coverageAnalysisForOrder" cascade="delete" copyable="true"/>
        <hasMany name="coverageAnalysisForOrdersDto" joinField="materialRequirementCoverage"
                 model="coverageAnalysisForOrderDto" cascade="delete" copyable="true" persistent="false"/>

        <hasMany name="coverageProducts" joinField="materialRequirementCoverage"
                 model="coverageProduct" cascade="delete" copyable="true"/>
        <hasMany name="coverageProductsDto" joinField="materialRequirementCoverage" model="coverageProductDto"
                 persistent="false"/>

        <manyToMany name="coverageOrders" joinField="materialRequirementCoverages" model="order"
                    plugin="orders"/>

        <hasMany name="coverageOrderStates" model="coverageOrderState" plugin="orderSupplies"
                 joinField="materialRequirementCoverage" cascade="delete" copyable="true"/>
    </fields>

    <hooks>
        <validatesWith
                class="com.qcadoo.mes.orderSupplies.validators.MaterialRequirementCoverageValidators"
                method="validatesWith"/>
    </hooks>

    <identifier expression="#number"/>

</model>
