<?xml version="1.0" encoding="UTF-8"?>
<!--

    ***************************************************************************
    Copyright (c) 2010 Qcadoo Limited
    Project: Qcadoo MES
    Version: 1.3

    This file is part of Qcadoo.

    Qcadoo is free software; you can redistribute it and/or modify
    it under the terms of the GNU Affero General Public License as published
    by the Free Software Foundation; either version 3 of the License,
    or (at your option) any later version.

    This program is distributed in the hope that it will be useful,
    but WITHOUT ANY WARRANTY; without even the implied warranty
    of MERCHANTABILITY or FITNESS FOR A PARTICULAR PURPOSE.
    See the GNU Affero General Public License for more details.

    You should have received a copy of the GNU Affero General Public License
    along with this program; if not, write to the Free Software
    Foundation, Inc., 51 Franklin St, Fifth Floor, Boston, MA  02110-1301  USA
    ***************************************************************************

-->
<model name="workPlan" activable="true"
	xmlns:xsi="http://www.w3.org/2001/XMLSchema-instance" xmlns="http://schema.qcadoo.org/model"
	xsi:schemaLocation="http://schema.qcadoo.org/model http://schema.qcadoo.org/model.xsd">

	<fields>
		<string name="name" required="true" unique="true">
			<validatesLength max="1024" />
		</string>
		<datetime name="date" />
		<string name="worker" />
		<boolean name="generated" />
		<string name="fileName" />
		<boolean name="dontPrintOrdersInWorkPlans" />

		<enum name="type"
			values="01noDistinction,02byEndProduct,03byWorkstationType,04byDivision"
			default="01allOperations" required="true" />

		<hasMany name="workPlanOrderColumns" plugin="workPlans"
			model="workPlanOrderColumn" joinField="workPlan" cascade="delete"
			copyable="true" />

		<manyToMany name="orders" joinField="workPlans" model="order"
			plugin="orders" copyable="true" />

		<belongsTo name="inputProductColumnToSortBy" model="columnForInputProducts" />
		<enum name="orderSorting" values="01asc,02desc"/>

	</fields>

	<hooks>
		<onCreate class="com.qcadoo.mes.workPlans.hooks.WorkPlanHooks"
			method="onCreate" />
		<onCopy class="com.qcadoo.mes.workPlans.hooks.WorkPlanHooks"
			method="onCopy" />
	</hooks>

	<identifier expression="#name" />
</model>