<?xml version="1.0" encoding="UTF-8"?>
<!--

    ***************************************************************************
    Copyright (c) 2010 Qcadoo Limited
    Project: Qcadoo MES
    Version: 1.4

    This file is part of Qcadoo.

    Qcadoo is free software; you can redistribute it and/or modify
    it under the terms of the GNU Affero General Public License as published
    by the Free Software Foundation; either version 3 of the License,
    or (at your option) any later version.

    This program is distributed in the hope that it will be useful,
    but WITHOUT ANY WARRANTY; without even the implied warranty
    of MERCHANTABILITY or FITNESS FOR A PARTICULAR PURPOSE.
    See the GNU Affero General Public License for more details.

    You should have received a copy of the GNU Affero General Public License
    along with this program; if not, write to the Free Software
    Foundation, Inc., 51 Franklin St, Fifth Floor, Boston, MA  02110-1301  USA
    ***************************************************************************

-->
<model name="operationProductInComponent"
       xmlns:xsi="http://www.w3.org/2001/XMLSchema-instance" xmlns="http://schema.qcadoo.org/model"
       xsi:schemaLocation="http://schema.qcadoo.org/model http://schema.qcadoo.org/model.xsd">

    <fields>
        <belongsTo name="technology" model="technology" persistent="false"/>
        <belongsTo name="operationComponent" model="technologyOperationComponent"
                   required="true"/>
        <priority name="priority" scope="operationComponent"/>
        <belongsTo name="product" plugin="basic" model="product"/>
        <decimal name="quantity">
            <validatesRange from="0" exclusively="true"/>
            <validatesUnscaledValue max="9"/>
            <validatesScale max="5"/>
        </decimal>
        <decimal name="givenQuantity">
            <validatesRange from="0" exclusively="true"/>
            <validatesUnscaledValue max="9"/>
            <validatesScale max="5"/>
        </decimal>
        <dictionary name="givenUnit" dictionary="units"/>
        <string name="quantityFormula" />
        <belongsTo name="technologyInputProductType" model="technologyInputProductType"/>
        <boolean name="differentProductsInDifferentSizes" default="false"/>
        <boolean name="variousQuantitiesInProductsBySize" default="false"/>
        <hasMany name="productBySizeGroups" model="productBySizeGroup"
                 joinField="operationProductInComponent" cascade="delete" copyable="true"/>
        <string name="description">
            <validatesLength max="2048"/>
        </string>

        <belongsTo name="attribute" model="attribute" plugin="basic"/>

        <boolean name="showInProductData" default="false"/>
        <decimal name="productDataNumber" default="0"/>

        <hasMany name="productDataInputs" model="productDataInput" joinField="operationProductInComponent"
                 cascade="delete"/>

        <hasMany name="sections" model="section" joinField="operationProductInComponent" copyable="true"
                 cascade="delete"/>
    </fields>

    <hooks>
        <onSave class="com.qcadoo.mes.technologies.hooks.OperationProductInComponentHooks"
                       method="onSave"/>
        <validatesWith class="com.qcadoo.mes.technologies.hooks.OperationProductInComponentHooks"
                       method="validatesWith"/>
    </hooks>
</model>
