<?xml version="1.0" encoding="UTF-8"?>
<!--

    ***************************************************************************
    Copyright (c) 2010 Qcadoo Limited
    Project: Qcadoo MES
    Version: 1.4

    This file is part of Qcadoo.

    Qcadoo is free software; you can redistribute it and/or modify
    it under the terms of the GNU Affero General Public License as published
    by the Free Software Foundation; either version 3 of the License,
    or (at your option) any later version.

    This program is distributed in the hope that it will be useful,
    but WITHOUT ANY WARRANTY; without even the implied warranty
    of MERCHANTABILITY or FITNESS FOR A PARTICULAR PURPOSE.
    See the GNU Affero General Public License for more details.

    You should have received a copy of the GNU Affero General Public License
    along with this program; if not, write to the Free Software
    Foundation, Inc., 51 Franklin St, Fifth Floor, Boston, MA  02110-1301  USA
    ***************************************************************************

-->
<model name="resourceDto"
       xmlns:xsi="http://www.w3.org/2001/XMLSchema-instance" xmlns="http://schema.qcadoo.org/model"
       xsi:schemaLocation="http://schema.qcadoo.org/model http://schema.qcadoo.org/model.xsd"
       activable="false" auditable="false" deletable="false" insertable="false" updatable="false">

    <fields>
        <string name="number"/>
        <string name="locationNumber"/>
        <integer name="location_id"/>
        <string name="productNumber"/>
        <string name="productName"/>
        <enum name="productGlobalTypeOfMaterial" values="01component,02intermediate,03finalProduct,04waste,05package"/>
        <decimal name="quantity"/>
        <string name="productUnit"/>
        <dictionary name="productCategory" dictionary="categories"/>
        <decimal name="quantityInAdditionalUnit"/>
        <string name="givenUnit"/>
        <decimal name="conversion"/>
        <decimal name="reservedQuantity"/>
        <decimal name="availableQuantity"/>
        <decimal name="price"/>
        <decimal name="value"/>
        <datetime name="time"/>
        <date name="productionDate"/>
        <date name="expirationDate"/>
        <string name="batchNumber"/>
        <string name="storageLocationNumber"/>
        <string name="palletNumber"/>
        <string name="typeOfLoadUnit"/>
        <string name="qualityRating"/>
        <string name="userName"/>
        <boolean name="isCorrected"/>
        <boolean name="waste"/>
        <string name="deliveryNumber"/>
        <string name="supplierNumber"/>
        <string name="documentNumber"/>
        <belongsTo name="positionAddMultiHelper" model="positionAddMultiHelper"/>
        <boolean name="blockedForQualityControl"/>
        <decimal name="colorResourcesAfterDeadline"/>
        <string name="expirationDateCellColor"/>
    </fields>

    <masterModel plugin="materialFlowResources" model="resource"/>
</model>
