<?xml version="1.0" encoding="UTF-8"?>
<!--

    ***************************************************************************
    Copyright (c) 2010 Qcadoo Limited
    Project: Qcadoo MES
    Version: 1.4

    This file is part of Qcadoo.

    Qcadoo is free software; you can redistribute it and/or modify
    it under the terms of the GNU Affero General Public License as published
    by the Free Software Foundation; either version 3 of the License,
    or (at your option) any later version.

    This program is distributed in the hope that it will be useful,
    but WITHOUT ANY WARRANTY; without even the implied warranty
    of MERCHANTABILITY or FITNESS FOR A PARTICULAR PURPOSE.
    See the GNU Affero General Public License for more details.

    You should have received a copy of the GNU Affero General Public License
    along with this program; if not, write to the Free Software
    Foundation, Inc., 51 Franklin St, Fifth Floor, Boston, MA  02110-1301  USA
    ***************************************************************************

-->
<model name="resource"
       xmlns:xsi="http://www.w3.org/2001/XMLSchema-instance" xmlns="http://schema.qcadoo.org/model"
       xsi:schemaLocation="http://schema.qcadoo.org/model http://schema.qcadoo.org/model.xsd">

    <fields>
        <!-- number generated in database trigger -->
        <string name="number" unique="true"/>
        <belongsTo name="location" model="location" plugin="materialFlow"
                   required="true"/>
        <belongsTo name="product" model="product" plugin="basic"
                   required="true"/>
        <decimal name="quantity" required="true">
            <validatesRange from="0" exclusively="true"/>
            <validatesUnscaledValue max="9"/>
            <validatesScale max="5"/>
        </decimal>
        <decimal name="price" default="0"/>

        <decimal name="value" persistent="false"/>
        <string name="_batch"/>
        <belongsTo name="batch" model="batch" plugin="advancedGenealogy"/>
        <datetime name="time" required="true"/>
        <datetime name="createDate"/>
        <date name="productionDate"/>
        <date name="expirationDate"/>
        <hasMany name="positions" joinField="resource" model="position"/>
        <hasMany name="resourceCorrections" joinField="resource" model="resourceCorrection"/>
        <boolean name="isCorrected" default="false"/>

        <belongsTo name="storageLocation" model="storageLocation"/>

        <decimal name="quantityInAdditionalUnit">
            <validatesRange from="0" exclusively="true"/>
            <validatesUnscaledValue max="9"/>
            <validatesScale max="5"/>
        </decimal>
        <decimal name="conversion" default="0"/>
        <belongsTo name="palletNumber" model="palletNumber" plugin="basic"/>
        <belongsTo name="typeOfLoadUnit" plugin="basic" model="typeOfLoadUnit" />
        <dictionary name="givenUnit" dictionary="units"/>
        <string name="userName"/>
        <boolean name="waste" default="false"/>

        <hasMany name="reservations" model="reservation" joinField="resource" cascade="delete"/>

        <decimal name="reservedQuantity">
            <validatesRange from="0"/>
            <validatesUnscaledValue max="9"/>
            <validatesScale max="5"/>
        </decimal>
        <decimal name="availableQuantity">
            <validatesRange from="0"/>
            <validatesUnscaledValue max="9"/>
            <validatesScale max="5"/>
        </decimal>

        <boolean name="validatePallet" default="true" persistent="false"/>

        <string name="deliveryNumber"/>
        <string name="documentNumber"/>

        <dictionary name="qualityRating" dictionary="qualityRating"/>
        <boolean name="blockedForQualityControl" default="false"/>
        <hasMany name="resourceAttributeValues" joinField="resource"
                       model="resourceAttributeValue" cascade="delete"/>
        <hasMany name="repackingPositions" joinField="resource" model="repackingPosition"/>
        <string name="resourceIds" persistent="false"/>
    </fields>

    <hooks>        
        <validatesWith
                class="com.qcadoo.mes.materialFlowResources.hooks.ResourceModelValidators"
                method="validatesWith"/>
        <onCreate
                class="com.qcadoo.mes.materialFlowResources.hooks.ResourceModelHooks"
                method="onCreate"/>
        <onSave
                class="com.qcadoo.mes.materialFlowResources.hooks.ResourceModelHooks"
                method="onSave"/>
    </hooks>
</model>
