<?xml version="1.0" encoding="UTF-8"?>
<!-- *************************************************************************** 
	Copyright (c) 2010 Qcadoo Limited Project: Qcadoo MES Version: 1.2.0-SNAPSHOT 
	This file is part of Qcadoo. Qcadoo is free software; you can redistribute 
	it and/or modify it under the terms of the GNU Affero General Public License 
	as published by the Free Software Foundation; either version 3 of the License, 
	or (at your option) any later version. This program is distributed in the 
	hope that it will be useful, but WITHOUT ANY WARRANTY; without even the implied 
	warranty of MERCHANTABILITY or FITNESS FOR A PARTICULAR PURPOSE. See the 
	GNU Affero General Public License for more details. You should have received 
	a copy of the GNU Affero General Public License along with this program; 
	if not, write to the Free Software Foundation, Inc., 51 Franklin St, Fifth 
	Floor, Boston, MA 02110-1301 USA 
*************************************************************************** -->
<model name="company" activable="true"
	xmlns:xsi="http://www.w3.org/2001/XMLSchema-instance" xmlns="http://schema.qcadoo.org/model"
	xsi:schemaLocation="http://schema.qcadoo.org/model http://schema.qcadoo.org/model.xsd">
	<fields>
		<string name="number" required="true" unique="true">
			<validatesLength max="255" />
		</string>
		<string name="name" required="true">
			<validatesLength max="255" />
		</string>
		<string name="tax" />
		<string name="street" />
		<string name="house">
			<validatesLength max="30" />
		</string>
		<string name="flat">
			<validatesLength max="30" />
		</string>
		<string name="zipCode">
			<validatesLength max="6" />
		</string>
		<string name="city" />
		<string name="state" />
		<string name="country" />
		<string name="email" />
		<string name="website" />
		<string name="phone" />
		<string name="externalNumber" unique="true"/>

	</fields>
	<hooks />
	<identifier expression="#number + ' - ' + #name" />
</model>